{
  "$schema": "https://json-schema.org/draft/2020-12/schema",
  "$id": "https://aictx.dev/schemas/v1/object.schema.json",
  "type": "object",
  "additionalProperties": false,
  "required": [
    "id",
    "type",
    "status",
    "title",
    "body_path",
    "scope",
    "content_hash",
    "created_at",
    "updated_at"
  ],
  "properties": {
    "id": {
      "type": "string",
      "pattern": "^[a-z][a-z0-9_]*\\.[a-z0-9][a-z0-9-]*$"
    },
    "type": {
      "enum": ["project", "architecture", "decision", "constraint", "question", "fact", "note", "concept"]
    },
    "status": {
      "enum": ["active", "draft", "stale", "superseded", "rejected", "open", "closed"]
    },
    "title": {
      "type": "string",
      "minLength": 1
    },
    "body_path": {
      "type": "string",
      "pattern": "^memory\\/.+\\.md$"
    },
    "scope": {
      "type": "object",
      "additionalProperties": false,
      "required": ["kind", "project", "branch", "task"],
      "properties": {
        "kind": {
          "enum": ["project", "branch", "task"]
        },
        "project": {
          "type": "string",
          "pattern": "^project\\.[a-z0-9][a-z0-9-]*$"
        },
        "branch": {
          "type": ["string", "null"]
        },
        "task": {
          "type": ["string", "null"]
        }
      }
    },
    "tags": {
      "type": "array",
      "items": {
        "type": "string",
        "pattern": "^[a-z0-9][a-z0-9-]*$"
      },
      "uniqueItems": true
    },
    "source": {
      "type": "object",
      "additionalProperties": false,
      "required": ["kind"],
      "properties": {
        "kind": {
          "enum": ["agent", "user", "cli", "mcp", "system"]
        },
        "task": {
          "type": "string"
        },
        "commit": {
          "type": "string",
          "minLength": 1
        }
      }
    },
    "superseded_by": {
      "type": ["string", "null"],
      "pattern": "^[a-z][a-z0-9_]*\\.[a-z0-9][a-z0-9-]*$"
    },
    "content_hash": {
      "type": "string",
      "pattern": "^sha256:[a-f0-9]{64}$"
    },
    "created_at": {
      "type": "string",
      "pattern": "^\\d{4}-\\d{2}-\\d{2}T\\d{2}:\\d{2}:\\d{2}(\\.\\d{1,9})?(Z|[+-]\\d{2}:\\d{2})$"
    },
    "updated_at": {
      "type": "string",
      "pattern": "^\\d{4}-\\d{2}-\\d{2}T\\d{2}:\\d{2}:\\d{2}(\\.\\d{1,9})?(Z|[+-]\\d{2}:\\d{2})$"
    }
  },
  "allOf": [
    {
      "if": {
        "properties": {
          "type": {
            "const": "question"
          }
        }
      },
      "then": {
        "properties": {
          "status": {
            "enum": ["active", "draft", "stale", "superseded", "rejected", "open", "closed"]
          }
        }
      },
      "else": {
        "properties": {
          "status": {
            "enum": ["active", "draft", "stale", "superseded", "rejected"]
          }
        }
      }
    }
  ]
}
