{
  "body_path": "memory/decisions/proactive-bootstrap-onboarding.md",
  "content_hash": "sha256:8ff835269f69c65a641b8c78b955611038e755206b12c26cbfb41bdf268fc7e3",
  "created_at": "2026-05-01T16:59:18+02:00",
  "id": "decision.proactive-bootstrap-onboarding",
  "scope": {
    "branch": null,
    "kind": "project",
    "project": "project.aictx",
    "task": null
  },
  "source": {
    "kind": "agent",
    "task": "Improve Aictx onboarding after init so users and agents know how to seed and use memory"
  },
  "status": "active",
  "tags": [
    "onboarding",
    "init",
    "viewer",
    "agent-guidance"
  ],
  "title": "Proactive bootstrap onboarding",
  "type": "decision",
  "updated_at": "2026-05-01T17:33:27+02:00"
}
