{
  "id": "decision.storage-fixtures",
  "type": "decision",
  "status": "active",
  "title": "Golden fixtures cover storage validation",
  "body_path": "memory/decisions/storage-fixtures.md",
  "scope": {
    "kind": "project",
    "project": "project.golden-rich",
    "branch": null,
    "task": null
  },
  "tags": [
    "fixtures",
    "validation"
  ],
  "source": {
    "kind": "agent",
    "task": "T044"
  },
  "superseded_by": null,
  "content_hash": "sha256:057bc3780887291a5a13a959dbc8fdaab20db1ee1ec2081fc21b906c407c92c0",
  "created_at": "2026-04-25T14:00:00+02:00",
  "updated_at": "2026-04-25T14:00:00+02:00"
}
