{
  "body_path": "memory/decisions/dirty-aictx-state-is-not-a-save-preflight-blocker.md",
  "content_hash": "sha256:1af00fd134aec7b5b78536333fafacc6ff25c87f11d939fe47b78290766e5b52",
  "created_at": "2026-05-01T17:54:54+02:00",
  "id": "decision.dirty-aictx-state-is-not-a-save-preflight-blocker",
  "scope": {
    "branch": null,
    "kind": "project",
    "project": "project.aictx",
    "task": null
  },
  "source": {
    "kind": "agent",
    "task": "Clarify dirty Aictx memory is not a save blocker in agent guidance"
  },
  "status": "active",
  "tags": [
    "agent-guidance",
    "memory-discipline",
    "dirty-state"
  ],
  "title": "Dirty Aictx state is not a save preflight blocker",
  "type": "decision",
  "updated_at": "2026-05-01T17:54:54+02:00"
}
