{
  "id": "constraint.hashes-deterministic",
  "type": "constraint",
  "status": "active",
  "title": "Fixture hashes must be deterministic",
  "body_path": "memory/constraints/hashes-deterministic.md",
  "scope": {
    "kind": "project",
    "project": "project.golden-rich",
    "branch": null,
    "task": null
  },
  "tags": [
    "hashes",
    "fixtures"
  ],
  "source": {
    "kind": "agent",
    "task": "T044"
  },
  "superseded_by": null,
  "content_hash": "sha256:9d92cb730f2eb8693dbe0cd1f7a07618efb9fc3f4548767d1e291ec3df84c04a",
  "created_at": "2026-04-25T14:00:00+02:00",
  "updated_at": "2026-04-25T14:00:00+02:00"
}
