{
  "id": "architecture.current",
  "type": "architecture",
  "status": "active",
  "title": "Current Architecture",
  "body_path": "memory/architecture.md",
  "scope": {
    "kind": "project",
    "project": "project.golden-rich",
    "branch": null,
    "task": null
  },
  "tags": [
    "architecture"
  ],
  "source": {
    "kind": "agent",
    "task": "T044"
  },
  "superseded_by": null,
  "content_hash": "sha256:926082d2792d7d2111fd4a2f09745ef5960307c3553d044ded787dd07c158feb",
  "created_at": "2026-04-25T14:00:00+02:00",
  "updated_at": "2026-04-25T14:00:00+02:00"
}
