{
  "body_path": "memory/decisions/init-guidance-documents-project-local-cli-fallbacks.md",
  "content_hash": "sha256:c0a640f227ede412b43c65ac7cce0567f451ae1e42a02a354202c63e7e74ed91",
  "created_at": "2026-05-01T17:45:17+02:00",
  "id": "decision.init-guidance-documents-project-local-cli-fallbacks",
  "scope": {
    "branch": null,
    "kind": "project",
    "project": "project.aictx",
    "task": null
  },
  "source": {
    "kind": "agent",
    "task": "Implement generated Aictx guidance PATH fallback commands for project-local npm and pnpm installs"
  },
  "status": "active",
  "tags": [
    "agent-guidance",
    "install",
    "cli",
    "mcp"
  ],
  "title": "Init guidance documents project-local CLI fallbacks",
  "type": "decision",
  "updated_at": "2026-05-01T17:45:17+02:00"
}
